{
  "projectName": "99 AI Games",
  "totalHalls": 9,
  "slotsPerHall": 11,
  "totalGameSlots": 99,
  "numberingPolicy": "Game numbers are global observation samples. Hall order does not force a numeric range; each hall can hold 11 official playable experiments.",
  "slotVariantRunPolicy": "The 99 game slots represent 99 observation samples, not 99 AI generations. A single game may contain multiple model variants and run records. Model comparisons are stored as variants/runs under the same game slot and do not consume additional game numbers.",
  "slotMixPerHall": {
    "benchmark": 3,
    "normal": 6,
    "failed-weird": 1,
    "future-remake": 1
  },
  "halls": [
    {
      "id": "arcade-reaction",
      "number": 1,
      "name": "Arcade Reaction Hall",
      "capacity": 11,
      "description": "Observes AI ability in feedback, timing, input feel, difficulty curves, and short-loop clarity.",
      "assignedGameNumbers": [3]
    },
    {
      "id": "puzzle-logic",
      "number": 2,
      "name": "Puzzle Logic Hall",
      "capacity": 11,
      "description": "Observes AI ability in rules, constraints, state logic, solvability, and puzzle communication.",
      "assignedGameNumbers": [2]
    },
    {
      "id": "survival-strategy",
      "number": 3,
      "name": "Survival Strategy Hall",
      "capacity": 11,
      "description": "Observes AI ability in resource pressure, route planning, risk feedback, and tactical systems.",
      "assignedGameNumbers": [1]
    },
    {
      "id": "card-strategy",
      "number": 4,
      "name": "Card Strategy Hall",
      "capacity": 11,
      "description": "Observes AI ability in probabilistic decisions, drafting, turn structure, and readable strategy.",
      "assignedGameNumbers": [4]
    },
    {
      "id": "text-adventure",
      "number": 5,
      "name": "Text Adventure Hall",
      "capacity": 11,
      "description": "Observes AI ability in branching narrative, state memory, tone, and meaningful choices.",
      "assignedGameNumbers": []
    },
    {
      "id": "clicker-management",
      "number": 6,
      "name": "Clicker Management Hall",
      "capacity": 11,
      "description": "Observes AI ability in economies, automation loops, scaling, and player motivation.",
      "assignedGameNumbers": [6]
    },
    {
      "id": "physics-experiment",
      "number": 7,
      "name": "Physics Experiment Hall",
      "capacity": 11,
      "description": "Observes AI ability in simulation feel, spatial reasoning, cause/effect, and sandbox tuning.",
      "assignedGameNumbers": [5]
    },
    {
      "id": "rhythm-audio",
      "number": 8,
      "name": "Rhythm Audio Hall",
      "capacity": 11,
      "description": "Observes AI ability in timing windows, pattern memory, audio feedback, and input precision.",
      "assignedGameNumbers": []
    },
    {
      "id": "ai-meme",
      "number": 9,
      "name": "AI Meme Hall",
      "capacity": 11,
      "description": "Observes AI ability in self-reference, humor, weird failure modes, and playful systems.",
      "assignedGameNumbers": []
    }
  ]
}
